	universal classification lr	universal classification knn	universal classification svm	universal classification rf	universal classification et	universal classification gbc	universal classification lightgbm
Inner CV F1 (mean/std)	0.64/0.02	0.72/0.02	0.62/0.01	0.78/0.03	0.75/0.03	0.81/0.02	0.82/0.02
Outer CV F1 (mean/std)	0.64/0.04	0.71/0.03	0.6/0.04	0.76/0.03	0.74/0.03	0.8/0.04	0.81/0.04
Test Set validation F1	0.65	0.76	0.59	0.82	0.78	0.85	0.86
Inner CV Accuracy (mean/std)	0.81/0.01	0.89/0.01	0.81/0.01	0.91/0.01	0.9/0.01	0.92/0.01	0.93/0.01
Outer CV Accuracy (mean/std)	0.81/0.03	0.89/0.01	0.84/0.02	0.91/0.01	0.9/0.01	0.92/0.02	0.93/0.02
Test Set validation Accuracy	0.81	0.91	0.83	0.93	0.91	0.94	0.94
Inner CV AUC (mean/std)	0.88/0.01	0.8/0.01	0.0/0.0	0.95/0.01	0.94/0.01	0.96/0.01	0.96/0.0
Outer CV AUC (mean/std)	0.88/0.03	0.8/0.02	0.87/0.03	0.95/0.01	0.93/0.02	0.96/0.01	0.97/0.01
Test Set validation AUC	0.9	0.84	0.74	0.97	0.96	0.97	0.97
