	universal classification lr	universal classification knn	universal classification svm	universal classification rf	universal classification et	universal classification gbc	universal classification lightgbm
Inner CV F1 (mean/std)	0.63/0.02	0.72/0.02	0.63/0.01	0.77/0.03	0.74/0.03	0.81/0.02	0.81/0.02
Outer CV F1 (mean/std)	0.63/0.05	0.72/0.02	0.62/0.04	0.74/0.03	0.73/0.03	0.8/0.04	0.8/0.05
Test Set validation F1	0.63	0.76	0.63	0.8	0.76	0.84	0.82
Inner CV Accuracy (mean/std)	0.81/0.01	0.89/0.01	0.81/0.01	0.91/0.01	0.9/0.01	0.92/0.01	0.92/0.01
Outer CV Accuracy (mean/std)	0.8/0.03	0.89/0.01	0.85/0.02	0.9/0.01	0.9/0.01	0.92/0.02	0.92/0.02
Test Set validation Accuracy	0.8	0.91	0.79	0.92	0.91	0.93	0.92
Inner CV AUC (mean/std)	0.88/0.01	0.81/0.01	0.0/0.0	0.95/0.01	0.94/0.01	0.96/0.01	0.95/0.01
Outer CV AUC (mean/std)	0.88/0.03	0.8/0.01	0.88/0.03	0.95/0.01	0.93/0.02	0.96/0.01	0.96/0.01
Test Set validation AUC	0.9	0.84	0.81	0.96	0.96	0.97	0.97
